Email,Status
"Thank you for applying to the Junior Software Developer position at MSC Technology.
Unfortunately, MSC Technology has moved to the next step in their hiring process, and your application was not selected at this time.",reject
"Thank you for your interest in the Train To Hire - Junior Software Developer position at Mindlance in Chicago, Illinois, United States. Unfortunately, we will not be moving forward with your application, but we appreciate your time and interest in Mindlance.",reject
"eth, 

Thank you for your interest in Exyn and for applying to be apart of our team as a Software Engineer, Product. We appreciate the opportunity to learn more about you and your professional accomplishments.

We were fortunate to have received so many terrific applications.  Although we were impressed with your background, we have decided to move forward with candidates whose skills and experiences are better aligned with that which we're seeking for this particular role.

As Exyn continues to grow, we’ll keep your information on file and look forward to reaching out to you when the right opportunity arises.

In the meantime, we wish you much success in your job search and career. 

Best wishes,

The People & Culture team at Exyn Technologies",reject
"Thank you for your interest in the Software Engineer position at Lantana Consulting Group in Vermont, United States. Unfortunately, we will not be moving forward with your application, but we appreciate your time and interest in Lantana Consulting Group.

Regards,

Lantana Consulting Group",reject
"Hi Seth,

Thank you for your interest in PathAI! Unfortunately, the hiring team has decided not to move forward with your candidacy at this time. 

Please feel free to keep in touch and reach out again in the future. You can connect with us on LinkedIN, Twitter, and AngelList. 

We appreciate your time and consideration, and wish you the best of luck with your search.

Take care,

PathAI Hiring Team",reject
"Hi Seth,

     Thank you for taking the time to apply for our Software Engineer I. Given the number of opportunities available for career growth and development we appreciate you considering Chewy.
     We received a large number of applicants for this role and after careful consideration and review we’re unfortunately unable to move forward with your candidacy at this time.  

     We have your information on file and will reach out in the future should there be another opportunity we feel is a good match. We wish you all the best in your job search and on your future endeavors.
Kind Regards,

The Chewy Campus Recruiting Team",reject
"Thank you for your interest in the Entry Level Software Developer position at ProSearch in Brunswick, Maine, United States. Unfortunately, we will not be moving forward with your application, but we appreciate your time and interest in ProSearch.
Regards,
ProSearch",reject
"Thank you for your interest in the Software Engineer position at Shields Health Solutions in Stoughton, Massachusetts, United States.

Unfortunately, Shields Health Solutions did not select your application to move forward in the hiring process.

Regards,
Shields Health Solutions",reject
"Seth,

Thanks for your interest in the Software Engineer position at Concinnate Solutions in Washington, District of Columbia, United States. Unfortunately, we will not be moving forward with your application but we appreciate your time and interest in Concinnate Solutions.

Regards,
Concinnate Solutions",reject
"Thank you for your interest in the Software Engineer position at Silicon Integration Initiative, Inc. in Austin, Texas, United States. Unfortunately, we will not be moving forward with your application, but we appreciate your time and interest in Silicon Integration Initiative, Inc..

Regards,

Silicon Integration Initiative, Inc.",reject
"Thank you for applying to the Java Developer position at Sports Information Analysis.
Unfortunately, Sports Information Analysis has moved to the next step in their hiring process, and your application was not selected at this time.",reject
"Thank you for your interest in RCCo. Unfortunately, at this time we are both hiring for the position of Junior Developer. We will keep your CV on file if the position opens on a future date. We wish you the best in your job search, and the best of the season as well. ",reject
"Thank you for applying to the ENTRY-LEVEL WEB PROGRAMMER position at Oahu Publications, Inc..
Unfortunately, Oahu Publications, Inc. has moved to the next step in their hiring process, and your application was not selected at this time.",reject
"Seth,

Thank you for your interest in our Software Engineer opening. Unfortunately, we have decided to pursue other candidates who are more aligned to our needs at this time. 

We want to highlight that many of our portfolio companies are currently hiring and your skill set may be a match for their needs. Here is the link to a website where all Techstars Portfolio companies post their open jobs around the globe: jobs.techstars.com. 

Thank you again for your interest in an employment opportunity with Techstars, and we wish you the best in your current job search.

Sincerely,
The Techstars Talent Acquisition Team",reject
"Thank you for your interest in the Software Engineer position at Advisor360° in Weston, Massachusetts, United States. Unfortunately, we will not be moving forward with your application, but we appreciate your time and interest in Advisor360°.

Best regards,
Advisor360°",reject
"Thank you for your interest in the iOS Developer UP TO $140K +EQUITY position at Profizi in Jersey City, New Jersey, United States. Unfortunately, we will not be moving forward with your application, but we appreciate your time and interest in Profizi.

Regards,

Profizi",reject
"Thank you for your interest in the Software Engineer position at Decentrix Inc. in Denver Metropolitan Area. Unfortunately, we will not be moving forward with your application, but we appreciate your time and interest in Decentrix Inc..

Regards,

Decentrix Inc.",reject
"Thank you for applying to the Entry Level Developer position at The Nexxus Group.
Unfortunately, The Nexxus Group has moved to the next step in their hiring process, and your application was not selected at this time.",reject
"Hello Seth,

Thank you very much for your interest in our Software Engineer - React/Redux opening. We've had a chance to discuss your background and qualifications with the hiring manager and unfortunately, we have decided to pursue other candidates who appear to match our requirements more closely at this time. Should requirements change on our side or if a similar position opens up, we will not hesitate to contact you.

Thank you again for your time and interest in an employment opportunity with Alteryx, Inc. We wish you the best of luck in your continued search.


Sincerely,
Alteryx Talent Acquisition ",reject
"Thank you for your interest in the Web Developer position at DiversityInc in Woodbridge Township, New Jersey, United States. Unfortunately, we will not be moving forward with your application, but we appreciate your time and interest in DiversityInc.
Regards,
DiversityInc",reject
"Thank you for applying to the Full Stack Developer position at Test Innovators.
Unfortunately, Test Innovators has moved to the next step in their hiring process, and your application was not selected at this time.",reject
"Thank you for applying to the Backend Developer position at YinzCam, Inc..
Unfortunately, YinzCam, Inc. has moved to the next step in their hiring process, and your application was not selected at this time.",reject
"Thank you for applying to the JavaScript / Ruby on Rails Developer - Remote / Work from Home position at Tithe.ly.
Unfortunately, Tithe.ly has moved to the next step in their hiring process, and your application was not selected at this time.",reject
"eth,

Thanks for your interest in the Mobile Software Developer position at NECS Inc. ( Software for Food Distributors) in Branford, CT. Unfortunately, we will not be moving forward with your application but we appreciate your time and interest in NECS Inc. ( Software for Food Distributors).

Regards,
NECS Inc. ( Software for Food Distributors)",reject
"Thank you for your interest in the Software Engineer, TikTok iOS position at TikTok in Mountain View, California, United States. Unfortunately, we will not be moving forward with your application, but we appreciate your time and interest in TikTok.
Regards,
TikTok",reject
"Seth,

Thank you for your interest in the Associate Software Engineer role at HPR. Unfortunately, we have decided not to proceed with your candidacy for the current opening.

Thank you again for your time and interest in HPR. We wish you the very best in your endeavors.

Regards,
HPR Recruiting",reject
"Hi Seth,

Thanks for your interest in Fritz AI. Unfortunately, we are unable to offer you a position at this time. We'll keep your resume on file and reach out if that changes in the future.

Best,
Jameson",reject
"Unfortunately, SoftSages Technology Inc has decided not to move forward with your Software Developer - entry level application at this time. ",reject
"Unfortunately, PatientsLikeMe, LLC has decided not to move forward with your Full Stack Software Engineer application at this time. ",reject
"Thank you for your interest in changing the world with us. We appreciate the opportunity to learn about your skills and accomplishments.
Unfortunately, you were not the most competitive candidate for the Java Developer, Junior role.* Although we can’t offer you this position, we’ll keep your resume on file for a year—if new opportunities come up that fit your skills and experience, we’ll let you know. And please continue to apply to other positions on boozallen.com/careers that inspire and excite you.
 
—Booz Allen Talent Acquisition Team",reject
"Hello Seth,

Thank you for giving us the opportunity to consider you for the position with us at Unity Technologies.  

We have carefully reviewed your experience and qualifications for this position, and unfortunately, we have decided not to move forward with your application at this time. 

Please keep checking our Careers Page, and LinkedIn Company Page, for other opportunities that may be of interest to you. 

We do appreciate your interest in Unity Technologies, and we wish you every success for the future. 

Regards, 

Unity Technologies Recruiting Team",reject
"Thanks for your interest in the Web Designer/Developer Intern/Consultant position at Cannabis Creative Group. We have reviewed your application. Unfortunately, you are not the right fit for the position at this time because we are looking for someone local.

Best of luck in your job search.

Sincerely,
CCG Human Resources",reject
"Thank you for your interest in joining the DICK'S Sporting Goods, Inc. team. We value candidates like you who are committed to excellence and share our passion for sports. Unfortunately, at this time we have decided to move forward with other candidates for the Software Engineering Internship position at Corporate.

 

While this wasn’t the best match for you to join our team right now, new opportunities are posted often. We recommend keeping an eye on our career site and applying to future roles that match your experience and skillset. You can also stay-in-the-know about what’s happening here and receive job-alerts that match your interests by joining our Talent Community.

 

We wish you every success in your career search.

 

Thank you,

DICK'S Sporting Goods, Inc.",reject
"Thank you for applying to the WordPress Developer/Web Development Intern position at RevoluSun.
Unfortunately, RevoluSun has moved to the next step in their hiring process, and your application was not selected at this time.",reject
"Thank you for your interest in our Developer Internship opening.

We have just recently filled this position, and unfortunately will not be able to move forward with your candidacy at this time.

Should something change on our side (or we get another job opening that matches your background), we will not hesitate to contact you.

Thank you again for your interest in an employment opportunity with Provenir Inc., and we wish you the best in your current job search.

Provenir Human Resources
www.provenir.com",reject
"Thank you for your interest in our UI Software Engineer (open to remote) position.

We were very fortunate to have a strong group of applicants to consider for this role and have recently filled this position. Unfortunately, because this role is no longer available, we will not be moving forward with your application.

New positions open up regularly and we encourage you to visit our careers page and apply to another opening that fits your interests and qualifications.

Thank you again for your interest in New Relic.

Best regards,
The New Relic Talent Acquisition Team",reject
"Thank you for your interest in Nuts.com and taking the time to apply for the Software Engineer role.
 
After carefully considering your qualifications, we have decided to pursue other candidates whose experience more closely aligns with the needs of the role.
 
Although we have not opted to move forward at this time, we encourage you to continue to check our Career page for future opportunities.

Thanks again for your interest in our company and we wish you the best of luck in your future endeavors.
 
Warm Regards,
 
The Nuts.com Talent Acquisition Team",reject
"Unfortunately, we have decided not to proceed with your candidacy for the current opening at DriveWealth.

We received many qualified applicants and have decided to move ahead with another candidate who we feel is a better match for this particular position. We will continue to grow and our needs are constantly changing. Please feel free to watch our job openings at DriveWealth Careers and follow us on LinkedIn for future opportunities.

Thanks again for your interest in DriveWealth and we wish you luck in your search.

Regards,
DriveWealth",reject
"Thank you for your interest in working with DPR Construction! After further review of your application, you will not be moving forward in the recruiting process for Software Developer . To apply to other opportunities, please make sure to visit our website at www.dpr.com/company/careers.

DPR Talent Acquisition ",reject
"Hi Seth
Thank you for taking the time to apply to the role of Software Engineer with VMware.

Unfortunately, it has been decided that this role will not be moving ahead.

We will, however, keep your resume on record and get in touch with you about future opportunities that may arise.

We wish you all the best in your job search and hope we will have the chance to consider you for another role in the future.

Sincerely,

VMware Human Resources ",reject
"Hi Seth,

Thanks so much for your interest in Software Engineer I-211299 with Cox Automotive.  Unfortunately, you haven't been selected to move forward with the next phase of the process.
 
We truly appreciate your interest in joining the Cox family of brands and encourage you to join our talent community to get notified of new roles that open up that may pique your interest.
 
Best wishes to you as you take the next steps of your career journey.",reject
"Thank you very much for your interest in a career at Intel! We have received your direct submission or referral for the following position:

Position: Software Engineer
Job Number: JR0148336
Application Date: 2020 Nov 09

There were several applications submitted for this position, and after careful review, unfortunately, we have
decided to pursue a different candidate whose experience and skills more closely meet the needs of this particular role.

Competition for jobs at Intel is always strong and we often have to make difficult choices between many high-caliber candidates.
Now that we have your information in our database, we will definitely reach out again with future openings for which you qualify.

We hope you will keep us in mind, too, and apply again in the future.
Thank you very much for considering a career at Intel. We know there are lots of companies out there to choose from and we greatly
appreciate your interest.

Kind regards,
Intel Talent Acquisition team",reject
"Thank you again for your interest in BluJay Solutions. We appreciated the chance to review your coding but unfortunately we have decided to move forward with other candidates.


As far as feedback, continue to work on the fundamentals of object oriented programing (inheritance, enums, abstraction) or object oriented concepts to reduce duplicate coding. We like to see files instead of long strings or having all the logic in the main. For exercise 2, the Semi should be extended into the code with the SUV as well. Please note this is general feedback and you may have done some of these but the candidates that showed most/all of these things are the candidates we moved forward with. 


Best of luck in your search,",reject
"Thank you for your interest in the Software Engineer, Staff position. While you have many positive attributes, unfortunately you have not been chosen for further consideration.
We hope that you’ll consider other opportunities with Fiserv. Please visit our career page at https://www.careers.fiserv.com/ to see the latest openings and join our Talent Network.
Thank you for your interest in Fiserv, and best wishes for a successful career search.

The Fiserv Recruiting Team ",reject
"Unfortunately, Vensit has decided not to move forward with your Junior Python Developer(Only W2 roles) application at this time. ",reject
"Thank you for your recent application for the opening at HomeAdvisor & Angie's List. Unfortunately, we have decided not to proceed with your candidacy at this time. We received many qualified applicants and have decided to move ahead with another candidate who we feel is a better match for this particular position.

Thanks again for your interest in HomeAdvisor & Angie's List; please check out our Careers page to see if another role might be a more suitable search now or in the future.

Regards,
",reject
"First and foremost, we’d like to thank you for your interest in Cogo and the Quantitative Data Analyst role. We know how stressful and time consuming the job application process can be, and we’re so appreciative that you took the time to speak to us and our team. Unfortunately, timing is everything, and we are putting this position on hold while we reevaluate our needs. 

We’d love to stay connected as we continue to grow our team. We strongly encourage you to keep an eye on our careers site and follow us on social media to get the inside scoop on what’s happening at Cogo. You can find us on LinkedIn, Instagram, and Twitter. 

While we know that emails like this are disappointing to read, we don’t want them to be! We look forward to staying connected and encourage you to check back with us in the future for new opportunities to join our team. 

Wishing you all the best,

The Cogo Recruiting Team ",reject
"Dear Seth,

Thank you for your recent inquiry into employment opportunities with the TJX.

Our Recruiters have reviewed your resume and unfortunately at this time we are not able to offer you further consideration for the position of Software Engineer - New Grads (January 2021). Please feel free to review our open positions at http://www.jobs.tjx.com for future openings that you may have interest in.

Thank you again for giving us the opportunity to consider you for employment and please accept our best wishes for success in your job search.

Sincerely,

The TJX Companies, Inc. Global Talent Acquisition Team",reject
"Thank you for applying for the Entry Level Software Developer  position at General Motors! We appreciate your interest in joining our team.

Unfortunately, for this role, we will not be moving forward with your application as other candidates were considered a better fit for the job.

Please note that this decision only applies to the  Entry Level Software Developer  position so if you have submitted other applications for other GM roles, you will be notified separately about next steps for those positions.

GM frequently posts new opportunities, so we encourage you to check our website often to explore new job postings that might interest you.

Thank you again for applying. We wish you all the best with your job search!

Sincerely,

",reject
"Thank you for your recent inquiry into employment opportunities with the TJX.

Our Recruiters have reviewed your resume and unfortunately at this time we are not able to offer you further consideration for the position of Software Engineer Intern. Please feel free to review our open positions at http://www.jobs.tjx.com for future openings that you may have interest in.

Thank you again for giving us the opportunity to consider you for employment and please accept our best wishes for success in your job search.

Sincerely,

The TJX Companies, Inc. Global Talent Acquisition Team",reject
"Thank you for applying to Ribbon! We receive applications from qualified candidates daily and are flattered that you would consider a career here. While our team was impressed by your background, we unfortunately don't see a strong mutual fit at this time for the role.
 
We appreciate you taking the time to learn more about Ribbon and encourage you to continue visiting our Careers page, as we will be adding new roles on a regular basis that may be a better fit.
 
All the best for your future!",reject
"Thank you for your interest in Travelers. It was our pleasure to review your qualifications for our Associate Software Engineer (Java), R-1681. Unfortunately, we are not able to offer you employment with Travelers at this time.

We appreciate the time you took to explore our career opportunities and learn about Travelers. Please continue to visit our Careers Site to view our most current job openings. You may also login to the Candidate Home to review your other job submissions, or to edit your profile. We wish you the best of luck in your career search.

Sincerely,
Travelers Talent Acquisition Team ",reject
"Thank you for your interest in TomTom. We appreciate the time that you took to apply for our Software Engineering Intern position.

Unfortunately, however, after careful review of your profile we decided not to proceed further with your application. Note that if you’ve applied for multiple positions, we’re reviewing your other application(s) and will reply separately.

We encourage you to stay on top of our latest job opportunities via our career website (tomtom.com/careers).

If you have any questions or concerns, feel free to contact us at recruitment@tomtom.com.

Thanks again. We wish you the best in your continued job search and career.

TomTom Recruitment Team ",reject
"Thanks so much for your interest in Software Engineer I, Advertising-202000592 with Cox Automotive.  Unfortunately, you haven't been selected to move forward with the next phase of the process.
 
We truly appreciate your interest in joining the Cox family of brands and encourage you to join our talent community to get notified of new roles that open up that may pique your interest.
 
Best wishes to you as you take the next steps of your career journey.",reject
"Unfortunately, we have decided not to proceed with your candidacy for the current opening at InterSystems.

We received many qualified applicants and have decided to move ahead with another candidate who we feel is a better match for this particular position.

Thanks again for your interest in InterSystems and we wish you luck in your search.

Regards,
InterSystems",reject
"Thank you for your interest in BAE Systems. We place a great emphasis on matching a candidate’s background and experience with available opportunities, and are continually impressed by the caliber of today’s candidates. We regret to inform you that you were not selected for the following position:

Entry Level Software Engineer - Engineering Leadership Development Program I - Defense, 65480BR.

Please log into your candidate portal at jobs.baesystems.com to check on the status of any other positions for which you applied. You can also connect with us on LinkedIn to see current openings

Thank you again for your interest in BAE Systems, and we wish you success in your professional endeavors.

Kind regards,",reject
"Thank you for your submission for the position of New College Graduate: Software Engineer I, Req ID 169410BR.

We regret to inform you that you were not selected for this position. We appreciate your desire to expand your career with Raytheon Technologies and encourage you to investigate other job positings with Raytheon Technologies and apply to any that are commensurate with your background and experience.

Please check your Job Submission status via the Job Center and navigate to the Candidate Zone to get the most updated status of other Raytheon Technologies opportunities to which you have applied.

Again, thank you for your interest in Raytheon Technologies.

Sincerely,

Raytheon Technologies Talent Acquisition
MA - Marlborough",reject
"Thank you for your interest in joining the Jelli team. We wanted to let you know that although your resume and cover letter were very competitive, our hiring team reviewed your application and did not select it for further consideration.

We wish you all the best in your job search.

Best regards,

Jelli, Inc.",reject
"Hope you are doing well.

We regret to inform you that the position you applied for has been filled by another candidate. We will retain your resume and if a position opens that closely matches your skill set, we will contact you at that time. Thanks again for your interest in employment at IAM Robotics.

Sincerely, ",reject
